0.102092 IP 10.1.1.1.49153 > 10.1.1.2.50001: Flags [S], seq 0, win 65535, options [TS val 100 ecr 0,wscale 7,sackOK,eol], length 0
0.102092 IP 10.1.1.2.50001 > 10.1.1.1.49153: Flags [S.], seq 0, ack 1, win 65535, options [TS val 102 ecr 100,wscale 7,sackOK,eol], length 0
0.106272 IP 10.1.1.1.49153 > 10.1.1.2.50001: Flags [.], ack 1, win 49152, options [TS val 104 ecr 102,eol], length 0
0.108675 IP 10.1.1.1.49153 > 10.1.1.2.50001: Flags [.], seq 1:1449, ack 1, win 49152, options [TS val 104 ecr 102,eol], length 1448
0.108675 IP 10.1.1.2.50001 > 10.1.1.1.49153: Flags [.], ack 1449, win 49152, options [TS val 108 ecr 104,eol], length 0
0.111078 IP 10.1.1.1.49153 > 10.1.1.2.50001: Flags [.], seq 1449:2897, ack 1, win 49152, options [TS val 104 ecr 102,eol], length 1448
0.113481 IP 10.1.1.1.49153 > 10.1.1.2.50001: Flags [.], seq 2897:4345, ack 1, win 49152, options [TS val 104 ecr 102,eol], length 1448
0.113481 IP 10.1.1.2.50001 > 10.1.1.1.49153: Flags [.], ack 4345, win 49152, options [TS val 113 ecr 104,eol], length 0
0.115884 IP 10.1.1.1.49153 > 10.1.1.2.50001: Flags [.], seq 4345:5793, ack 1, win 49152, options [TS val 104 ecr 102,eol], length 1448
0.118288 IP 10.1.1.1.49153 > 10.1.1.2.50001: Flags [.], seq 5793:7241, ack 1, win 49152, options [TS val 104 ecr 102,eol], length 1448
0.118288 IP 10.1.1.2.50001 > 10.1.1.1.49153: Flags [.], ack 7241, win 49152, options [TS val 118 ecr 104,eol], length 0
0.120691 IP 10.1.1.1.49153 > 10.1.1.2.50001: Flags [.], seq 7241:8689, ack 1, win 49152, options [TS val 104 ecr 102,eol], length 1448
0.123094 IP 10.1.1.1.49153 > 10.1.1.2.50001: Flags [.], seq 8689:10137, ack 1, win 49152, options [TS val 104 ecr 102,eol], length 1448
0.123094 IP 10.1.1.2.50001 > 10.1.1.1.49153: Flags [.], ack 10137, win 49152, options [TS val 123 ecr 104,eol], length 0
0.125497 IP 10.1.1.1.49153 > 10.1.1.2.50001: Flags [.], seq 10137:11585, ack 1, win 49152, options [TS val 104 ecr 102,eol], length 1448
0.127900 IP 10.1.1.1.49153 > 10.1.1.2.50001: Flags [.], seq 11585:13033, ack 1, win 49152, options [TS val 104 ecr 102,eol], length 1448
0.127900 IP 10.1.1.2.50001 > 10.1.1.1.49153: Flags [.], ack 13033, win 49152, options [TS val 127 ecr 104,eol], length 0
0.130304 IP 10.1.1.1.49153 > 10.1.1.2.50001: Flags [.], seq 13033:14481, ack 1, win 49152, options [TS val 104 ecr 102,eol], length 1448
0.132707 IP 10.1.1.1.49153 > 10.1.1.2.50001: Flags [.], seq 14481:15929, ack 1, win 49152, options [TS val 110 ecr 108,eol], length 1448
0.132707 IP 10.1.1.2.50001 > 10.1.1.1.49153: Flags [.], ack 15929, win 49152, options [TS val 132 ecr 104,eol], length 0
0.135110 IP 10.1.1.1.49153 > 10.1.1.2.50001: Flags [.], seq 15929:17377, ack 1, win 49152, options [TS val 110 ecr 108,eol], length 1448
0.137513 IP 10.1.1.1.49153 > 10.1.1.2.50001: Flags [.], seq 17377:18825, ack 1, win 49152, options [TS val 115 ecr 113,eol], length 1448
0.137513 IP 10.1.1.2.50001 > 10.1.1.1.49153: Flags [.], ack 18825, win 49152, options [TS val 137 ecr 110,eol], length 0
0.139916 IP 10.1.1.1.49153 > 10.1.1.2.50001: Flags [.], seq 18825:20273, ack 1, win 49152, options [TS val 115 ecr 113,eol], length 1448
0.142320 IP 10.1.1.1.49153 > 10.1.1.2.50001: Flags [.], seq 20273:21721, ack 1, win 49152, options [TS val 115 ecr 113,eol], length 1448
0.142320 IP 10.1.1.2.50001 > 10.1.1.1.49153: Flags [.], ack 21721, win 49152, options [TS val 142 ecr 115,eol], length 0
0.144723 IP 10.1.1.1.49153 > 10.1.1.2.50001: Flags [.], seq 21721:23169, ack 1, win 49152, options [TS val 115 ecr 113,eol], length 1448
0.147126 IP 10.1.1.1.49153 > 10.1.1.2.50001: Flags [.], seq 23169:24617, ack 1, win 49152, options [TS val 120 ecr 118,eol], length 1448
0.147126 IP 10.1.1.2.50001 > 10.1.1.1.49153: Flags [.], ack 24617, win 49152, options [TS val 147 ecr 115,eol], length 0
0.149529 IP 10.1.1.1.49153 > 10.1.1.2.50001: Flags [.], seq 24617:26065, ack 1, win 49152, options [TS val 120 ecr 118,eol], length 1448
0.151932 IP 10.1.1.1.49153 > 10.1.1.2.50001: Flags [.], seq 26065:27513, ack 1, win 49152, options [TS val 120 ecr 118,eol], length 1448
0.151932 IP 10.1.1.2.50001 > 10.1.1.1.49153: Flags [.], ack 27513, win 49152, options [TS val 151 ecr 120,eol], length 0
0.154336 IP 10.1.1.1.49153 > 10.1.1.2.50001: Flags [.], seq 27513:28961, ack 1, win 49152, options [TS val 120 ecr 118,eol], length 1448
0.156739 IP 10.1.1.1.49153 > 10.1.1.2.50001: Flags [.], seq 28961:30409, ack 1, win 49152, options [TS val 125 ecr 123,eol], length 1448
0.156739 IP 10.1.1.2.50001 > 10.1.1.1.49153: Flags [.], ack 30409, win 49152, options [TS val 156 ecr 120,eol], length 0
0.159142 IP 10.1.1.1.49153 > 10.1.1.2.50001: Flags [.], seq 30409:31857, ack 1, win 49152, options [TS val 125 ecr 123,eol], length 1448
0.161545 IP 10.1.1.1.49153 > 10.1.1.2.50001: Flags [.], seq 31857:33305, ack 1, win 49152, options [TS val 125 ecr 123,eol], length 1448
0.161545 IP 10.1.1.2.50001 > 10.1.1.1.49153: Flags [.], ack 33305, win 49152, options [TS val 161 ecr 125,eol], length 0
0.163948 IP 10.1.1.1.49153 > 10.1.1.2.50001: Flags [.], seq 33305:34753, ack 1, win 49152, options [TS val 125 ecr 123,eol], length 1448
0.166352 IP 10.1.1.1.49153 > 10.1.1.2.50001: Flags [.], seq 34753:36201, ack 1, win 49152, options [TS val 129 ecr 127,eol], length 1448
0.166352 IP 10.1.1.2.50001 > 10.1.1.1.49153: Flags [.], ack 36201, win 49152, options [TS val 166 ecr 125,eol], length 0
0.168755 IP 10.1.1.1.49153 > 10.1.1.2.50001: Flags [.], seq 36201:37649, ack 1, win 49152, options [TS val 130 ecr 127,eol], length 1448
0.171158 IP 10.1.1.1.49153 > 10.1.1.2.50001: Flags [.], seq 37649:39097, ack 1, win 49152, options [TS val 130 ecr 127,eol], length 1448
0.171158 IP 10.1.1.2.50001 > 10.1.1.1.49153: Flags [.], ack 39097, win 49152, options [TS val 171 ecr 130,eol], length 0
0.173561 IP 10.1.1.1.49153 > 10.1.1.2.50001: Flags [.], seq 39097:40545, ack 1, win 49152, options [TS val 130 ecr 127,eol], length 1448
0.175964 IP 10.1.1.1.49153 > 10.1.1.2.50001: Flags [.], seq 40545:41993, ack 1, win 49152, options [TS val 134 ecr 132,eol], length 1448
0.175964 IP 10.1.1.2.50001 > 10.1.1.1.49153: Flags [.], ack 41993, win 49152, options [TS val 175 ecr 130,eol], length 0
0.178368 IP 10.1.1.1.49153 > 10.1.1.2.50001: Flags [.], seq 41993:43441, ack 1, win 49152, options [TS val 134 ecr 132,eol], length 1448
0.180771 IP 10.1.1.1.49153 > 10.1.1.2.50001: Flags [.], seq 43441:44889, ack 1, win 49152, options [TS val 139 ecr 137,eol], length 1448
0.180771 IP 10.1.1.2.50001 > 10.1.1.1.49153: Flags [.], ack 44889, win 49152, options [TS val 180 ecr 134,eol], length 0
0.183174 IP 10.1.1.1.49153 > 10.1.1.2.50001: Flags [.], seq 44889:46337, ack 1, win 49152, options [TS val 139 ecr 137,eol], length 1448
0.185577 IP 10.1.1.1.49153 > 10.1.1.2.50001: Flags [.], seq 46337:47785, ack 1, win 49152, options [TS val 144 ecr 142,eol], length 1448
0.185577 IP 10.1.1.2.50001 > 10.1.1.1.49153: Flags [.], ack 47785, win 49152, options [TS val 185 ecr 139,eol], length 0
0.187980 IP 10.1.1.1.49153 > 10.1.1.2.50001: Flags [.], seq 47785:49233, ack 1, win 49152, options [TS val 144 ecr 142,eol], length 1448
0.190384 IP 10.1.1.1.49153 > 10.1.1.2.50001: Flags [.], seq 49233:50681, ack 1, win 49152, options [TS val 149 ecr 147,eol], length 1448
0.190384 IP 10.1.1.2.50001 > 10.1.1.1.49153: Flags [.], ack 50681, win 49152, options [TS val 190 ecr 144,eol], length 0
0.192787 IP 10.1.1.1.49153 > 10.1.1.2.50001: Flags [.], seq 50681:52129, ack 1, win 49152, options [TS val 149 ecr 147,eol], length 1448
0.195190 IP 10.1.1.1.49153 > 10.1.1.2.50001: Flags [.], seq 52129:53577, ack 1, win 49152, options [TS val 154 ecr 151,eol], length 1448
0.195190 IP 10.1.1.2.50001 > 10.1.1.1.49153: Flags [.], ack 53577, win 49152, options [TS val 195 ecr 149,eol], length 0
0.197593 IP 10.1.1.1.49153 > 10.1.1.2.50001: Flags [.], seq 53577:55025, ack 1, win 49152, options [TS val 154 ecr 151,eol], length 1448
0.199996 IP 10.1.1.1.49153 > 10.1.1.2.50001: Flags [.], seq 55025:56473, ack 1, win 49152, options [TS val 158 ecr 156,eol], length 1448
0.199996 IP 10.1.1.2.50001 > 10.1.1.1.49153: Flags [.], ack 56473, win 49152, options [TS val 199 ecr 154,eol], length 0
0.202400 IP 10.1.1.1.49153 > 10.1.1.2.50001: Flags [.], seq 56473:57921, ack 1, win 49152, options [TS val 158 ecr 156,eol], length 1448
0.204803 IP 10.1.1.1.49153 > 10.1.1.2.50001: Flags [.], seq 57921:59369, ack 1, win 49152, options [TS val 163 ecr 161,eol], length 1448
0.204803 IP 10.1.1.2.50001 > 10.1.1.1.49153: Flags [.], ack 59369, win 49152, options [TS val 204 ecr 158,eol], length 0
0.207206 IP 10.1.1.1.49153 > 10.1.1.2.50001: Flags [.], seq 59369:60817, ack 1, win 49152, options [TS val 163 ecr 161,eol], length 1448
0.209609 IP 10.1.1.1.49153 > 10.1.1.2.50001: Flags [.], seq 60817:62265, ack 1, win 49152, options [TS val 168 ecr 166,eol], length 1448
0.209609 IP 10.1.1.2.50001 > 10.1.1.1.49153: Flags [.], ack 62265, win 49152, options [TS val 209 ecr 163,eol], length 0
0.212012 IP 10.1.1.1.49153 > 10.1.1.2.50001: Flags [.], seq 62265:63713, ack 1, win 49152, options [TS val 168 ecr 166,eol], length 1448
0.214416 IP 10.1.1.1.49153 > 10.1.1.2.50001: Flags [.], seq 63713:65161, ack 1, win 49152, options [TS val 173 ecr 171,eol], length 1448
0.214416 IP 10.1.1.2.50001 > 10.1.1.1.49153: Flags [.], ack 65161, win 49152, options [TS val 214 ecr 168,eol], length 0
0.216819 IP 10.1.1.1.49153 > 10.1.1.2.50001: Flags [.], seq 65161:66609, ack 1, win 49152, options [TS val 173 ecr 171,eol], length 1448
0.219222 IP 10.1.1.1.49153 > 10.1.1.2.50001: Flags [.], seq 68057:69505, ack 1, win 49152, options [TS val 178 ecr 175,eol], length 1448
0.219222 IP 10.1.1.2.50001 > 10.1.1.1.49153: Flags [.], ack 66609, win 49152, options [TS val 219 ecr 173,sack 1 {68057:69505}], length 0
0.221625 IP 10.1.1.1.49153 > 10.1.1.2.50001: Flags [.], seq 69505:70953, ack 1, win 49152, options [TS val 182 ecr 180,eol], length 1448
0.221625 IP 10.1.1.2.50001 > 10.1.1.1.49153: Flags [.], ack 66609, win 49152, options [TS val 221 ecr 173,sack 1 {68057:70953}], length 0
0.224028 IP 10.1.1.1.49153 > 10.1.1.2.50001: Flags [.], seq 70953:72401, ack 1, win 49152, options [TS val 182 ecr 180,eol], length 1448
0.224028 IP 10.1.1.2.50001 > 10.1.1.1.49153: Flags [.], ack 66609, win 49152, options [TS val 224 ecr 173,sack 1 {68057:72401}], length 0
0.226432 IP 10.1.1.1.49153 > 10.1.1.2.50001: Flags [.], seq 72401:73849, ack 1, win 49152, options [TS val 187 ecr 185,eol], length 1448
0.226432 IP 10.1.1.2.50001 > 10.1.1.1.49153: Flags [.], ack 66609, win 49152, options [TS val 226 ecr 173,sack 1 {68057:73849}], length 0
0.228835 IP 10.1.1.1.49153 > 10.1.1.2.50001: Flags [.], seq 73849:75297, ack 1, win 49152, options [TS val 187 ecr 185,eol], length 1448
0.228835 IP 10.1.1.2.50001 > 10.1.1.1.49153: Flags [.], ack 66609, win 49152, options [TS val 228 ecr 173,sack 1 {68057:75297}], length 0
0.231238 IP 10.1.1.1.49153 > 10.1.1.2.50001: Flags [.], seq 75297:76745, ack 1, win 49152, options [TS val 192 ecr 190,eol], length 1448
0.231238 IP 10.1.1.2.50001 > 10.1.1.1.49153: Flags [.], ack 66609, win 49152, options [TS val 231 ecr 173,sack 1 {68057:76745}], length 0
0.233641 IP 10.1.1.1.49153 > 10.1.1.2.50001: Flags [.], seq 76745:78193, ack 1, win 49152, options [TS val 192 ecr 190,eol], length 1448
0.233641 IP 10.1.1.2.50001 > 10.1.1.1.49153: Flags [.], ack 66609, win 49152, options [TS val 233 ecr 173,sack 1 {68057:78193}], length 0
0.236044 IP 10.1.1.1.49153 > 10.1.1.2.50001: Flags [.], seq 78193:79641, ack 1, win 49152, options [TS val 197 ecr 195,eol], length 1448
0.236044 IP 10.1.1.2.50001 > 10.1.1.1.49153: Flags [.], ack 66609, win 49152, options [TS val 236 ecr 173,sack 1 {68057:79641}], length 0
0.238448 IP 10.1.1.1.49153 > 10.1.1.2.50001: Flags [.], seq 79641:81089, ack 1, win 49152, options [TS val 197 ecr 195,eol], length 1448
0.238448 IP 10.1.1.2.50001 > 10.1.1.1.49153: Flags [.], ack 66609, win 49152, options [TS val 238 ecr 173,sack 1 {68057:81089}], length 0
0.240851 IP 10.1.1.1.49153 > 10.1.1.2.50001: Flags [.], seq 81089:82537, ack 1, win 49152, options [TS val 202 ecr 199,eol], length 1448
0.240851 IP 10.1.1.2.50001 > 10.1.1.1.49153: Flags [.], ack 66609, win 49152, options [TS val 240 ecr 173,sack 1 {68057:82537}], length 0
0.243254 IP 10.1.1.1.49153 > 10.1.1.2.50001: Flags [.], seq 82537:83985, ack 1, win 49152, options [TS val 202 ecr 199,eol], length 1448
0.243254 IP 10.1.1.2.50001 > 10.1.1.1.49153: Flags [.], ack 66609, win 49152, options [TS val 243 ecr 173,sack 1 {68057:83985}], length 0
0.245657 IP 10.1.1.1.49153 > 10.1.1.2.50001: Flags [.], seq 83985:85433, ack 1, win 49152, options [TS val 206 ecr 204,eol], length 1448
0.245657 IP 10.1.1.2.50001 > 10.1.1.1.49153: Flags [.], ack 66609, win 49152, options [TS val 245 ecr 173,sack 1 {68057:85433}], length 0
0.248060 IP 10.1.1.1.49153 > 10.1.1.2.50001: Flags [.], seq 85433:86881, ack 1, win 49152, options [TS val 207 ecr 204,eol], length 1448
0.248060 IP 10.1.1.2.50001 > 10.1.1.1.49153: Flags [.], ack 66609, win 49152, options [TS val 248 ecr 173,sack 1 {68057:86881}], length 0
0.250464 IP 10.1.1.1.49153 > 10.1.1.2.50001: Flags [.], seq 86881:88329, ack 1, win 49152, options [TS val 211 ecr 209,eol], length 1448
0.250464 IP 10.1.1.2.50001 > 10.1.1.1.49153: Flags [.], ack 66609, win 49152, options [TS val 250 ecr 173,sack 1 {68057:88329}], length 0
0.252867 IP 10.1.1.1.49153 > 10.1.1.2.50001: Flags [.], seq 88329:89777, ack 1, win 49152, options [TS val 211 ecr 209,eol], length 1448
0.252867 IP 10.1.1.2.50001 > 10.1.1.1.49153: Flags [.], ack 66609, win 49152, options [TS val 252 ecr 173,sack 1 {68057:89777}], length 0
0.255270 IP 10.1.1.1.49153 > 10.1.1.2.50001: Flags [.], seq 89777:91225, ack 1, win 49152, options [TS val 216 ecr 214,eol], length 1448
0.255270 IP 10.1.1.2.50001 > 10.1.1.1.49153: Flags [.], ack 66609, win 49152, options [TS val 255 ecr 173,sack 1 {68057:91225}], length 0
0.257673 IP 10.1.1.1.49153 > 10.1.1.2.50001: Flags [.], seq 91225:92673, ack 1, win 49152, options [TS val 216 ecr 214,eol], length 1448
0.257673 IP 10.1.1.2.50001 > 10.1.1.1.49153: Flags [.], ack 66609, win 49152, options [TS val 257 ecr 173,sack 1 {68057:92673}], length 0
0.260076 IP 10.1.1.1.49153 > 10.1.1.2.50001: Flags [.], seq 92673:94121, ack 1, win 49152, options [TS val 221 ecr 219,eol], length 1448
0.260076 IP 10.1.1.2.50001 > 10.1.1.1.49153: Flags [.], ack 66609, win 49152, options [TS val 260 ecr 173,sack 1 {68057:94121}], length 0
0.262480 IP 10.1.1.1.49153 > 10.1.1.2.50001: Flags [.], seq 94121:95569, ack 1, win 49152, options [TS val 221 ecr 219,eol], length 1448
0.262480 IP 10.1.1.2.50001 > 10.1.1.1.49153: Flags [.], ack 66609, win 49152, options [TS val 262 ecr 173,sack 1 {68057:95569}], length 0
0.264883 IP 10.1.1.1.49153 > 10.1.1.2.50001: Flags [.], seq 95569:97017, ack 1, win 49152, options [TS val 223 ecr 221,eol], length 1448
0.264883 IP 10.1.1.2.50001 > 10.1.1.1.49153: Flags [.], ack 66609, win 49152, options [TS val 264 ecr 173,sack 1 {68057:97017}], length 0
0.267286 IP 10.1.1.1.49153 > 10.1.1.2.50001: Flags [.], seq 66609:68057, ack 1, win 49152, options [TS val 226 ecr 224,eol], length 1448
0.267286 IP 10.1.1.2.50001 > 10.1.1.1.49153: Flags [.], ack 97017, win 49152, options [TS val 267 ecr 226,eol], length 0
0.269689 IP 10.1.1.1.49153 > 10.1.1.2.50001: Flags [.], seq 97017:98465, ack 1, win 49152, options [TS val 228 ecr 226,eol], length 1448
0.272092 IP 10.1.1.1.49153 > 10.1.1.2.50001: Flags [.], seq 98465:99913, ack 1, win 49152, options [TS val 230 ecr 228,eol], length 1448
0.272092 IP 10.1.1.2.50001 > 10.1.1.1.49153: Flags [.], ack 99913, win 49152, options [TS val 272 ecr 228,eol], length 0
0.274496 IP 10.1.1.1.49153 > 10.1.1.2.50001: Flags [.], seq 99913:101361, ack 1, win 49152, options [TS val 233 ecr 231,eol], length 1448
0.276899 IP 10.1.1.1.49153 > 10.1.1.2.50001: Flags [.], seq 101361:102809, ack 1, win 49152, options [TS val 235 ecr 233,eol], length 1448
0.276899 IP 10.1.1.2.50001 > 10.1.1.1.49153: Flags [.], ack 102809, win 49152, options [TS val 276 ecr 233,eol], length 0
0.279302 IP 10.1.1.1.49153 > 10.1.1.2.50001: Flags [.], seq 102809:104257, ack 1, win 49152, options [TS val 238 ecr 236,eol], length 1448
0.281705 IP 10.1.1.1.49153 > 10.1.1.2.50001: Flags [.], seq 104257:105705, ack 1, win 49152, options [TS val 240 ecr 238,eol], length 1448
0.281705 IP 10.1.1.2.50001 > 10.1.1.1.49153: Flags [.], ack 105705, win 49152, options [TS val 281 ecr 238,eol], length 0
0.284108 IP 10.1.1.1.49153 > 10.1.1.2.50001: Flags [.], seq 105705:107153, ack 1, win 49152, options [TS val 242 ecr 240,eol], length 1448
0.286512 IP 10.1.1.1.49153 > 10.1.1.2.50001: Flags [.], seq 107153:108601, ack 1, win 49152, options [TS val 245 ecr 243,eol], length 1448
0.286512 IP 10.1.1.2.50001 > 10.1.1.1.49153: Flags [.], ack 108601, win 49152, options [TS val 286 ecr 242,eol], length 0
0.288915 IP 10.1.1.1.49153 > 10.1.1.2.50001: Flags [.], seq 108601:110049, ack 1, win 49152, options [TS val 247 ecr 245,eol], length 1448
0.291318 IP 10.1.1.1.49153 > 10.1.1.2.50001: Flags [.], seq 110049:111497, ack 1, win 49152, options [TS val 250 ecr 248,eol], length 1448
0.291318 IP 10.1.1.2.50001 > 10.1.1.1.49153: Flags [.], ack 111497, win 49152, options [TS val 291 ecr 247,eol], length 0
0.293721 IP 10.1.1.1.49153 > 10.1.1.2.50001: Flags [.], seq 111497:112945, ack 1, win 49152, options [TS val 252 ecr 250,eol], length 1448
0.296124 IP 10.1.1.1.49153 > 10.1.1.2.50001: Flags [.], seq 112945:114393, ack 1, win 49152, options [TS val 254 ecr 252,eol], length 1448
0.296124 IP 10.1.1.2.50001 > 10.1.1.1.49153: Flags [.], ack 114393, win 49152, options [TS val 296 ecr 252,eol], length 0
0.298528 IP 10.1.1.1.49153 > 10.1.1.2.50001: Flags [.], seq 114393:115841, ack 1, win 49152, options [TS val 257 ecr 255,eol], length 1448
0.300931 IP 10.1.1.1.49153 > 10.1.1.2.50001: Flags [.], seq 115841:117289, ack 1, win 49152, options [TS val 259 ecr 257,eol], length 1448
0.300931 IP 10.1.1.2.50001 > 10.1.1.1.49153: Flags [.], ack 117289, win 49152, options [TS val 300 ecr 257,eol], length 0
0.303334 IP 10.1.1.1.49153 > 10.1.1.2.50001: Flags [.], seq 117289:118737, ack 1, win 49152, options [TS val 262 ecr 260,eol], length 1448
0.305737 IP 10.1.1.1.49153 > 10.1.1.2.50001: Flags [.], seq 118737:120185, ack 1, win 49152, options [TS val 264 ecr 262,eol], length 1448
0.305737 IP 10.1.1.2.50001 > 10.1.1.1.49153: Flags [.], ack 120185, win 49152, options [TS val 305 ecr 262,eol], length 0
0.308140 IP 10.1.1.1.49153 > 10.1.1.2.50001: Flags [.], seq 120185:121633, ack 1, win 49152, options [TS val 266 ecr 264,eol], length 1448
0.310544 IP 10.1.1.1.49153 > 10.1.1.2.50001: Flags [.], seq 121633:123081, ack 1, win 49152, options [TS val 269 ecr 267,eol], length 1448
0.310544 IP 10.1.1.2.50001 > 10.1.1.1.49153: Flags [.], ack 123081, win 49152, options [TS val 310 ecr 266,eol], length 0
0.312947 IP 10.1.1.1.49153 > 10.1.1.2.50001: Flags [.], seq 123081:124529, ack 1, win 49152, options [TS val 269 ecr 267,eol], length 1448
0.315350 IP 10.1.1.1.49153 > 10.1.1.2.50001: Flags [.], seq 124529:125977, ack 1, win 49152, options [TS val 269 ecr 267,eol], length 1448
0.315350 IP 10.1.1.2.50001 > 10.1.1.1.49153: Flags [.], ack 125977, win 49152, options [TS val 315 ecr 269,eol], length 0
0.317753 IP 10.1.1.1.49153 > 10.1.1.2.50001: Flags [.], seq 125977:127425, ack 1, win 49152, options [TS val 269 ecr 267,eol], length 1448
0.320156 IP 10.1.1.1.49153 > 10.1.1.2.50001: Flags [.], seq 128873:130321, ack 1, win 49152, options [TS val 270 ecr 267,eol], length 1448
0.320156 IP 10.1.1.2.50001 > 10.1.1.1.49153: Flags [.], ack 127425, win 49152, options [TS val 320 ecr 269,sack 1 {128873:130321}], length 0
0.322560 IP 10.1.1.1.49153 > 10.1.1.2.50001: Flags [.], seq 130321:131769, ack 1, win 49152, options [TS val 270 ecr 267,eol], length 1448
0.322560 IP 10.1.1.2.50001 > 10.1.1.1.49153: Flags [.], ack 127425, win 49152, options [TS val 322 ecr 269,sack 1 {128873:131769}], length 0
0.324963 IP 10.1.1.1.49153 > 10.1.1.2.50001: Flags [.], seq 131769:133217, ack 1, win 49152, options [TS val 270 ecr 267,eol], length 1448
0.324963 IP 10.1.1.2.50001 > 10.1.1.1.49153: Flags [.], ack 127425, win 49152, options [TS val 324 ecr 269,sack 1 {128873:133217}], length 0
0.327366 IP 10.1.1.1.49153 > 10.1.1.2.50001: Flags [.], seq 133217:134665, ack 1, win 49152, options [TS val 270 ecr 267,eol], length 1448
0.327366 IP 10.1.1.2.50001 > 10.1.1.1.49153: Flags [.], ack 127425, win 49152, options [TS val 327 ecr 269,sack 1 {128873:134665}], length 0
0.329769 IP 10.1.1.1.49153 > 10.1.1.2.50001: Flags [.], seq 134665:136113, ack 1, win 49152, options [TS val 270 ecr 267,eol], length 1448
0.329769 IP 10.1.1.2.50001 > 10.1.1.1.49153: Flags [.], ack 127425, win 49152, options [TS val 329 ecr 269,sack 1 {128873:136113}], length 0
0.332172 IP 10.1.1.1.49153 > 10.1.1.2.50001: Flags [.], seq 136113:137561, ack 1, win 49152, options [TS val 270 ecr 267,eol], length 1448
0.332172 IP 10.1.1.2.50001 > 10.1.1.1.49153: Flags [.], ack 127425, win 49152, options [TS val 332 ecr 269,sack 1 {128873:137561}], length 0
0.334576 IP 10.1.1.1.49153 > 10.1.1.2.50001: Flags [.], seq 137561:139009, ack 1, win 49152, options [TS val 270 ecr 267,eol], length 1448
0.334576 IP 10.1.1.2.50001 > 10.1.1.1.49153: Flags [.], ack 127425, win 49152, options [TS val 334 ecr 269,sack 1 {128873:139009}], length 0
0.336979 IP 10.1.1.1.49153 > 10.1.1.2.50001: Flags [.], seq 139009:140457, ack 1, win 49152, options [TS val 271 ecr 267,eol], length 1448
0.336979 IP 10.1.1.2.50001 > 10.1.1.1.49153: Flags [.], ack 127425, win 49152, options [TS val 336 ecr 269,sack 1 {128873:140457}], length 0
0.339382 IP 10.1.1.1.49153 > 10.1.1.2.50001: Flags [.], seq 140457:141905, ack 1, win 49152, options [TS val 271 ecr 267,eol], length 1448
0.339382 IP 10.1.1.2.50001 > 10.1.1.1.49153: Flags [.], ack 127425, win 49152, options [TS val 339 ecr 269,sack 1 {128873:141905}], length 0
0.341785 IP 10.1.1.1.49153 > 10.1.1.2.50001: Flags [.], seq 141905:143353, ack 1, win 49152, options [TS val 271 ecr 267,eol], length 1448
0.341785 IP 10.1.1.2.50001 > 10.1.1.1.49153: Flags [.], ack 127425, win 49152, options [TS val 341 ecr 269,sack 1 {128873:143353}], length 0
0.344188 IP 10.1.1.1.49153 > 10.1.1.2.50001: Flags [.], seq 143353:144801, ack 1, win 49152, options [TS val 271 ecr 267,eol], length 1448
0.344188 IP 10.1.1.2.50001 > 10.1.1.1.49153: Flags [.], ack 127425, win 49152, options [TS val 344 ecr 269,sack 1 {128873:144801}], length 0
0.346592 IP 10.1.1.1.49153 > 10.1.1.2.50001: Flags [.], seq 144801:146249, ack 1, win 49152, options [TS val 271 ecr 267,eol], length 1448
0.346592 IP 10.1.1.2.50001 > 10.1.1.1.49153: Flags [.], ack 127425, win 49152, options [TS val 346 ecr 269,sack 1 {128873:146249}], length 0
0.348995 IP 10.1.1.1.49153 > 10.1.1.2.50001: Flags [.], seq 146249:147697, ack 1, win 49152, options [TS val 271 ecr 267,eol], length 1448
0.348995 IP 10.1.1.2.50001 > 10.1.1.1.49153: Flags [.], ack 127425, win 49152, options [TS val 348 ecr 269,sack 1 {128873:147697}], length 0
0.351398 IP 10.1.1.1.49153 > 10.1.1.2.50001: Flags [.], seq 147697:149145, ack 1, win 49152, options [TS val 271 ecr 267,eol], length 1448
0.351398 IP 10.1.1.2.50001 > 10.1.1.1.49153: Flags [.], ack 127425, win 49152, options [TS val 351 ecr 269,sack 1 {128873:149145}], length 0
0.353801 IP 10.1.1.1.49153 > 10.1.1.2.50001: Flags [.], seq 149145:150593, ack 1, win 49152, options [TS val 272 ecr 267,eol], length 1448
0.353801 IP 10.1.1.2.50001 > 10.1.1.1.49153: Flags [.], ack 127425, win 49152, options [TS val 353 ecr 269,sack 1 {128873:150593}], length 0
0.356204 IP 10.1.1.1.49153 > 10.1.1.2.50001: Flags [.], seq 150593:152041, ack 1, win 49152, options [TS val 272 ecr 267,eol], length 1448
0.356204 IP 10.1.1.2.50001 > 10.1.1.1.49153: Flags [.], ack 127425, win 49152, options [TS val 356 ecr 269,sack 1 {128873:152041}], length 0
0.358608 IP 10.1.1.1.49153 > 10.1.1.2.50001: Flags [.], seq 152041:153489, ack 1, win 49152, options [TS val 272 ecr 267,eol], length 1448
0.358608 IP 10.1.1.2.50001 > 10.1.1.1.49153: Flags [.], ack 127425, win 49152, options [TS val 358 ecr 269,sack 1 {128873:153489}], length 0
0.361011 IP 10.1.1.1.49153 > 10.1.1.2.50001: Flags [.], seq 153489:154937, ack 1, win 49152, options [TS val 272 ecr 267,eol], length 1448
0.361011 IP 10.1.1.2.50001 > 10.1.1.1.49153: Flags [.], ack 127425, win 49152, options [TS val 361 ecr 269,sack 1 {128873:154937}], length 0
0.363414 IP 10.1.1.1.49153 > 10.1.1.2.50001: Flags [.], seq 154937:156385, ack 1, win 49152, options [TS val 272 ecr 267,eol], length 1448
0.363414 IP 10.1.1.2.50001 > 10.1.1.1.49153: Flags [.], ack 127425, win 49152, options [TS val 363 ecr 269,sack 1 {128873:156385}], length 0
0.365817 IP 10.1.1.1.49153 > 10.1.1.2.50001: Flags [.], seq 156385:157833, ack 1, win 49152, options [TS val 272 ecr 267,eol], length 1448
0.365817 IP 10.1.1.2.50001 > 10.1.1.1.49153: Flags [.], ack 127425, win 49152, options [TS val 365 ecr 269,sack 1 {128873:157833}], length 0
0.368220 IP 10.1.1.1.49153 > 10.1.1.2.50001: Flags [.], seq 157833:159281, ack 1, win 49152, options [TS val 272 ecr 267,eol], length 1448
0.368220 IP 10.1.1.2.50001 > 10.1.1.1.49153: Flags [.], ack 127425, win 49152, options [TS val 368 ecr 269,sack 1 {128873:159281}], length 0
0.370624 IP 10.1.1.1.49153 > 10.1.1.2.50001: Flags [.], seq 160729:162177, ack 1, win 49152, options [TS val 273 ecr 267,eol], length 1448
0.370624 IP 10.1.1.2.50001 > 10.1.1.1.49153: Flags [.], ack 127425, win 49152, options [TS val 370 ecr 269,sack 2 {160729:162177}{128873:159281}], length 0
0.373027 IP 10.1.1.1.49153 > 10.1.1.2.50001: Flags [.], seq 162177:163625, ack 1, win 49152, options [TS val 273 ecr 267,eol], length 1448
0.373027 IP 10.1.1.2.50001 > 10.1.1.1.49153: Flags [.], ack 127425, win 49152, options [TS val 373 ecr 269,sack 2 {160729:163625}{128873:159281}], length 0
0.375430 IP 10.1.1.1.49153 > 10.1.1.2.50001: Flags [.], seq 163625:165073, ack 1, win 49152, options [TS val 273 ecr 267,eol], length 1448
0.375430 IP 10.1.1.2.50001 > 10.1.1.1.49153: Flags [.], ack 127425, win 49152, options [TS val 375 ecr 269,sack 2 {160729:165073}{128873:159281}], length 0
0.377833 IP 10.1.1.1.49153 > 10.1.1.2.50001: Flags [.], seq 165073:166521, ack 1, win 49152, options [TS val 273 ecr 267,eol], length 1448
0.377833 IP 10.1.1.2.50001 > 10.1.1.1.49153: Flags [.], ack 127425, win 49152, options [TS val 377 ecr 269,sack 2 {160729:166521}{128873:159281}], length 0
0.380236 IP 10.1.1.1.49153 > 10.1.1.2.50001: Flags [.], seq 166521:167969, ack 1, win 49152, options [TS val 273 ecr 267,eol], length 1448
0.380236 IP 10.1.1.2.50001 > 10.1.1.1.49153: Flags [.], ack 127425, win 49152, options [TS val 380 ecr 269,sack 2 {160729:167969}{128873:159281}], length 0
0.382640 IP 10.1.1.1.49153 > 10.1.1.2.50001: Flags [.], seq 167969:169417, ack 1, win 49152, options [TS val 273 ecr 267,eol], length 1448
0.382640 IP 10.1.1.2.50001 > 10.1.1.1.49153: Flags [.], ack 127425, win 49152, options [TS val 382 ecr 269,sack 2 {160729:169417}{128873:159281}], length 0
0.385043 IP 10.1.1.1.49153 > 10.1.1.2.50001: Flags [.], seq 169417:170865, ack 1, win 49152, options [TS val 273 ecr 267,eol], length 1448
0.385043 IP 10.1.1.2.50001 > 10.1.1.1.49153: Flags [.], ack 127425, win 49152, options [TS val 385 ecr 269,sack 2 {160729:170865}{128873:159281}], length 0
0.387446 IP 10.1.1.1.49153 > 10.1.1.2.50001: Flags [.], seq 170865:172313, ack 1, win 49152, options [TS val 274 ecr 267,eol], length 1448
0.387446 IP 10.1.1.2.50001 > 10.1.1.1.49153: Flags [.], ack 127425, win 49152, options [TS val 387 ecr 269,sack 2 {160729:172313}{128873:159281}], length 0
0.389849 IP 10.1.1.1.49153 > 10.1.1.2.50001: Flags [.], seq 172313:173761, ack 1, win 49152, options [TS val 274 ecr 272,eol], length 1448
0.389849 IP 10.1.1.2.50001 > 10.1.1.1.49153: Flags [.], ack 127425, win 49152, options [TS val 389 ecr 269,sack 2 {160729:173761}{128873:159281}], length 0
0.392252 IP 10.1.1.1.49153 > 10.1.1.2.50001: Flags [.], seq 173761:175209, ack 1, win 49152, options [TS val 274 ecr 272,eol], length 1448
0.392252 IP 10.1.1.2.50001 > 10.1.1.1.49153: Flags [.], ack 127425, win 49152, options [TS val 392 ecr 269,sack 2 {160729:175209}{128873:159281}], length 0
0.394656 IP 10.1.1.1.49153 > 10.1.1.2.50001: Flags [.], seq 175209:176657, ack 1, win 49152, options [TS val 274 ecr 272,eol], length 1448
0.394656 IP 10.1.1.2.50001 > 10.1.1.1.49153: Flags [.], ack 127425, win 49152, options [TS val 394 ecr 269,sack 2 {160729:176657}{128873:159281}], length 0
0.397059 IP 10.1.1.1.49153 > 10.1.1.2.50001: Flags [.], seq 176657:178105, ack 1, win 49152, options [TS val 274 ecr 272,eol], length 1448
0.397059 IP 10.1.1.2.50001 > 10.1.1.1.49153: Flags [.], ack 127425, win 49152, options [TS val 397 ecr 269,sack 2 {160729:178105}{128873:159281}], length 0
0.399462 IP 10.1.1.1.49153 > 10.1.1.2.50001: Flags [.], seq 178105:179553, ack 1, win 49152, options [TS val 274 ecr 272,eol], length 1448
0.399462 IP 10.1.1.2.50001 > 10.1.1.1.49153: Flags [.], ack 127425, win 49152, options [TS val 399 ecr 269,sack 2 {160729:179553}{128873:159281}], length 0
0.401865 IP 10.1.1.1.49153 > 10.1.1.2.50001: Flags [.], seq 179553:181001, ack 1, win 49152, options [TS val 274 ecr 272,eol], length 1448
0.401865 IP 10.1.1.2.50001 > 10.1.1.1.49153: Flags [.], ack 127425, win 49152, options [TS val 401 ecr 269,sack 2 {160729:181001}{128873:159281}], length 0
0.404268 IP 10.1.1.1.49153 > 10.1.1.2.50001: Flags [.], seq 181001:182449, ack 1, win 49152, options [TS val 275 ecr 272,eol], length 1448
0.404268 IP 10.1.1.2.50001 > 10.1.1.1.49153: Flags [.], ack 127425, win 49152, options [TS val 404 ecr 269,sack 2 {160729:182449}{128873:159281}], length 0
0.406672 IP 10.1.1.1.49153 > 10.1.1.2.50001: Flags [.], seq 182449:183897, ack 1, win 49152, options [TS val 275 ecr 272,eol], length 1448
0.406672 IP 10.1.1.2.50001 > 10.1.1.1.49153: Flags [.], ack 127425, win 49152, options [TS val 406 ecr 269,sack 2 {160729:183897}{128873:159281}], length 0
0.409075 IP 10.1.1.1.49153 > 10.1.1.2.50001: Flags [.], seq 183897:185345, ack 1, win 49152, options [TS val 275 ecr 272,eol], length 1448
0.409075 IP 10.1.1.2.50001 > 10.1.1.1.49153: Flags [.], ack 127425, win 49152, options [TS val 409 ecr 269,sack 2 {160729:185345}{128873:159281}], length 0
0.411478 IP 10.1.1.1.49153 > 10.1.1.2.50001: Flags [.], seq 185345:186793, ack 1, win 49152, options [TS val 275 ecr 272,eol], length 1448
0.411478 IP 10.1.1.2.50001 > 10.1.1.1.49153: Flags [.], ack 127425, win 49152, options [TS val 411 ecr 269,sack 2 {160729:186793}{128873:159281}], length 0
0.413881 IP 10.1.1.1.49153 > 10.1.1.2.50001: Flags [.], seq 186793:188241, ack 1, win 49152, options [TS val 275 ecr 272,eol], length 1448
0.413881 IP 10.1.1.2.50001 > 10.1.1.1.49153: Flags [.], ack 127425, win 49152, options [TS val 413 ecr 269,sack 2 {160729:188241}{128873:159281}], length 0
0.416284 IP 10.1.1.1.49153 > 10.1.1.2.50001: Flags [.], seq 188241:189689, ack 1, win 49152, options [TS val 275 ecr 272,eol], length 1448
0.416284 IP 10.1.1.2.50001 > 10.1.1.1.49153: Flags [.], ack 127425, win 49152, options [TS val 416 ecr 269,sack 2 {160729:189689}{128873:159281}], length 0
0.418688 IP 10.1.1.1.49153 > 10.1.1.2.50001: Flags [.], seq 189689:191137, ack 1, win 49152, options [TS val 275 ecr 272,eol], length 1448
0.418688 IP 10.1.1.2.50001 > 10.1.1.1.49153: Flags [.], ack 127425, win 49152, options [TS val 418 ecr 269,sack 2 {160729:191137}{128873:159281}], length 0
0.421091 IP 10.1.1.1.49153 > 10.1.1.2.50001: Flags [.], seq 191137:192585, ack 1, win 49152, options [TS val 276 ecr 272,eol], length 1448
0.421091 IP 10.1.1.2.50001 > 10.1.1.1.49153: Flags [.], ack 127425, win 49152, options [TS val 421 ecr 269,sack 2 {160729:192585}{128873:159281}], length 0
0.423494 IP 10.1.1.1.49153 > 10.1.1.2.50001: Flags [.], seq 192585:194033, ack 1, win 49152, options [TS val 276 ecr 272,eol], length 1448
0.423494 IP 10.1.1.2.50001 > 10.1.1.1.49153: Flags [.], ack 127425, win 49152, options [TS val 423 ecr 269,sack 2 {160729:194033}{128873:159281}], length 0
0.425897 IP 10.1.1.1.49153 > 10.1.1.2.50001: Flags [.], seq 195481:196929, ack 1, win 49152, options [TS val 276 ecr 272,eol], length 1448
0.425897 IP 10.1.1.2.50001 > 10.1.1.1.49153: Flags [.], ack 127425, win 49152, options [TS val 425 ecr 269,sack 3 {195481:196929}{160729:194033}{128873:159281}], length 0
0.428300 IP 10.1.1.1.49153 > 10.1.1.2.50001: Flags [.], seq 196929:198377, ack 1, win 49152, options [TS val 276 ecr 272,eol], length 1448
0.428300 IP 10.1.1.2.50001 > 10.1.1.1.49153: Flags [.], ack 127425, win 49152, options [TS val 428 ecr 269,sack 3 {195481:198377}{160729:194033}{128873:159281}], length 0
0.430704 IP 10.1.1.1.49153 > 10.1.1.2.50001: Flags [.], seq 198377:199825, ack 1, win 49152, options [TS val 276 ecr 272,eol], length 1448
0.430704 IP 10.1.1.2.50001 > 10.1.1.1.49153: Flags [.], ack 127425, win 49152, options [TS val 430 ecr 269,sack 3 {195481:199825}{160729:194033}{128873:159281}], length 0
0.433107 IP 10.1.1.1.49153 > 10.1.1.2.50001: Flags [.], seq 199825:201273, ack 1, win 49152, options [TS val 276 ecr 272,eol], length 1448
0.433107 IP 10.1.1.2.50001 > 10.1.1.1.49153: Flags [.], ack 127425, win 49152, options [TS val 433 ecr 269,sack 3 {195481:201273}{160729:194033}{128873:159281}], length 0
0.435510 IP 10.1.1.1.49153 > 10.1.1.2.50001: Flags [.], seq 201273:202721, ack 1, win 49152, options [TS val 276 ecr 272,eol], length 1448
0.435510 IP 10.1.1.2.50001 > 10.1.1.1.49153: Flags [.], ack 127425, win 49152, options [TS val 435 ecr 269,sack 3 {195481:202721}{160729:194033}{128873:159281}], length 0
0.437913 IP 10.1.1.1.49153 > 10.1.1.2.50001: Flags [.], seq 202721:204169, ack 1, win 49152, options [TS val 277 ecr 272,eol], length 1448
0.437913 IP 10.1.1.2.50001 > 10.1.1.1.49153: Flags [.], ack 127425, win 49152, options [TS val 437 ecr 269,sack 3 {195481:204169}{160729:194033}{128873:159281}], length 0
0.440316 IP 10.1.1.1.49153 > 10.1.1.2.50001: Flags [.], seq 204169:205617, ack 1, win 49152, options [TS val 277 ecr 272,eol], length 1448
0.440316 IP 10.1.1.2.50001 > 10.1.1.1.49153: Flags [.], ack 127425, win 49152, options [TS val 440 ecr 269,sack 3 {195481:205617}{160729:194033}{128873:159281}], length 0
0.442720 IP 10.1.1.1.49153 > 10.1.1.2.50001: Flags [.], seq 205617:207065, ack 1, win 49152, options [TS val 277 ecr 272,eol], length 1448
0.442720 IP 10.1.1.2.50001 > 10.1.1.1.49153: Flags [.], ack 127425, win 49152, options [TS val 442 ecr 269,sack 3 {195481:207065}{160729:194033}{128873:159281}], length 0
0.445123 IP 10.1.1.1.49153 > 10.1.1.2.50001: Flags [.], seq 207065:208513, ack 1, win 49152, options [TS val 277 ecr 272,eol], length 1448
0.445123 IP 10.1.1.2.50001 > 10.1.1.1.49153: Flags [.], ack 127425, win 49152, options [TS val 445 ecr 269,sack 3 {195481:208513}{160729:194033}{128873:159281}], length 0
0.447526 IP 10.1.1.1.49153 > 10.1.1.2.50001: Flags [.], seq 208513:209961, ack 1, win 49152, options [TS val 277 ecr 272,eol], length 1448
0.447526 IP 10.1.1.2.50001 > 10.1.1.1.49153: Flags [.], ack 127425, win 49152, options [TS val 447 ecr 269,sack 3 {195481:209961}{160729:194033}{128873:159281}], length 0
0.449929 IP 10.1.1.1.49153 > 10.1.1.2.50001: Flags [.], seq 209961:211409, ack 1, win 49152, options [TS val 277 ecr 272,eol], length 1448
0.449929 IP 10.1.1.2.50001 > 10.1.1.1.49153: Flags [.], ack 127425, win 49152, options [TS val 449 ecr 269,sack 3 {195481:211409}{160729:194033}{128873:159281}], length 0
0.452332 IP 10.1.1.1.49153 > 10.1.1.2.50001: Flags [.], seq 211409:212857, ack 1, win 49152, options [TS val 277 ecr 272,eol], length 1448
0.452332 IP 10.1.1.2.50001 > 10.1.1.1.49153: Flags [.], ack 127425, win 49152, options [TS val 452 ecr 269,sack 3 {195481:212857}{160729:194033}{128873:159281}], length 0
0.454736 IP 10.1.1.1.49153 > 10.1.1.2.50001: Flags [.], seq 212857:214305, ack 1, win 49152, options [TS val 278 ecr 272,eol], length 1448
0.454736 IP 10.1.1.2.50001 > 10.1.1.1.49153: Flags [.], ack 127425, win 49152, options [TS val 454 ecr 269,sack 3 {195481:214305}{160729:194033}{128873:159281}], length 0
0.457139 IP 10.1.1.1.49153 > 10.1.1.2.50001: Flags [.], seq 214305:215753, ack 1, win 49152, options [TS val 278 ecr 272,eol], length 1448
0.457139 IP 10.1.1.2.50001 > 10.1.1.1.49153: Flags [.], ack 127425, win 49152, options [TS val 457 ecr 269,sack 3 {195481:215753}{160729:194033}{128873:159281}], length 0
0.459542 IP 10.1.1.1.49153 > 10.1.1.2.50001: Flags [.], seq 215753:217201, ack 1, win 49152, options [TS val 278 ecr 272,eol], length 1448
0.459542 IP 10.1.1.2.50001 > 10.1.1.1.49153: Flags [.], ack 127425, win 49152, options [TS val 459 ecr 269,sack 3 {195481:217201}{160729:194033}{128873:159281}], length 0
0.461945 IP 10.1.1.1.49153 > 10.1.1.2.50001: Flags [.], seq 217201:218649, ack 1, win 49152, options [TS val 278 ecr 272,eol], length 1448
0.461945 IP 10.1.1.2.50001 > 10.1.1.1.49153: Flags [.], ack 127425, win 49152, options [TS val 461 ecr 269,sack 3 {195481:218649}{160729:194033}{128873:159281}], length 0
0.464348 IP 10.1.1.1.49153 > 10.1.1.2.50001: Flags [.], seq 218649:220097, ack 1, win 49152, options [TS val 278 ecr 272,eol], length 1448
0.464348 IP 10.1.1.2.50001 > 10.1.1.1.49153: Flags [.], ack 127425, win 49152, options [TS val 464 ecr 269,sack 3 {195481:220097}{160729:194033}{128873:159281}], length 0
0.466752 IP 10.1.1.1.49153 > 10.1.1.2.50001: Flags [.], seq 220097:221545, ack 1, win 49152, options [TS val 278 ecr 272,eol], length 1448
0.466752 IP 10.1.1.2.50001 > 10.1.1.1.49153: Flags [.], ack 127425, win 49152, options [TS val 466 ecr 269,sack 3 {195481:221545}{160729:194033}{128873:159281}], length 0
0.469155 IP 10.1.1.1.49153 > 10.1.1.2.50001: Flags [.], seq 221545:222993, ack 1, win 49152, options [TS val 278 ecr 272,eol], length 1448
0.469155 IP 10.1.1.2.50001 > 10.1.1.1.49153: Flags [.], ack 127425, win 49152, options [TS val 469 ecr 269,sack 3 {195481:222993}{160729:194033}{128873:159281}], length 0
0.471558 IP 10.1.1.1.49153 > 10.1.1.2.50001: Flags [.], seq 222993:224441, ack 1, win 49152, options [TS val 279 ecr 276,eol], length 1448
0.471558 IP 10.1.1.2.50001 > 10.1.1.1.49153: Flags [.], ack 127425, win 49152, options [TS val 471 ecr 269,sack 3 {195481:224441}{160729:194033}{128873:159281}], length 0
0.473961 IP 10.1.1.1.49153 > 10.1.1.2.50001: Flags [.], seq 224441:225889, ack 1, win 49152, options [TS val 279 ecr 276,eol], length 1448
0.473961 IP 10.1.1.2.50001 > 10.1.1.1.49153: Flags [.], ack 127425, win 49152, options [TS val 473 ecr 269,sack 3 {195481:225889}{160729:194033}{128873:159281}], length 0
0.476364 IP 10.1.1.1.49153 > 10.1.1.2.50001: Flags [.], seq 227337:228785, ack 1, win 49152, options [TS val 279 ecr 276,eol], length 1448
0.476364 IP 10.1.1.2.50001 > 10.1.1.1.49153: Flags [.], ack 127425, win 49152, options [TS val 476 ecr 269,sack 3 {227337:228785}{195481:225889}{160729:194033}], length 0
0.478768 IP 10.1.1.1.49153 > 10.1.1.2.50001: Flags [.], seq 228785:230233, ack 1, win 49152, options [TS val 279 ecr 276,eol], length 1448
0.478768 IP 10.1.1.2.50001 > 10.1.1.1.49153: Flags [.], ack 127425, win 49152, options [TS val 478 ecr 269,sack 3 {227337:230233}{195481:225889}{160729:194033}], length 0
0.481171 IP 10.1.1.1.49153 > 10.1.1.2.50001: Flags [.], seq 230233:231681, ack 1, win 49152, options [TS val 279 ecr 276,eol], length 1448
0.481171 IP 10.1.1.2.50001 > 10.1.1.1.49153: Flags [.], ack 127425, win 49152, options [TS val 481 ecr 269,sack 3 {227337:231681}{195481:225889}{160729:194033}], length 0
0.483574 IP 10.1.1.1.49153 > 10.1.1.2.50001: Flags [.], seq 231681:233129, ack 1, win 49152, options [TS val 279 ecr 276,eol], length 1448
0.483574 IP 10.1.1.2.50001 > 10.1.1.1.49153: Flags [.], ack 127425, win 49152, options [TS val 483 ecr 269,sack 3 {227337:233129}{195481:225889}{160729:194033}], length 0
0.485977 IP 10.1.1.1.49153 > 10.1.1.2.50001: Flags [.], seq 233129:234577, ack 1, win 49152, options [TS val 280 ecr 276,eol], length 1448
